,0,1,2,3,4,reviewType
121,Y,0,6,5,I love the Kung Pao chicken.,pos
122,Y,0,2,5,The food is great and the staff recognizes us and gives us great service. We try and get there at least once a week for lunch. Better menu than P F Chang,pos
123,Y,0,1,1,Terrible customer service!  We got the wrong change back and called back after we got home from picking up our order and all the manager had to say was it had been too long to be able to tell if the change was wrong!  What ever happened to the customer is always right.  I will never go back to this place again!,neg
124,Y,0,2,2,I had a  take out order. Eggroll was old and tasteless. The wonton soup was poor at best. watered down broth and wontons fell apart from sitting to long in broth. I wont go back.,pos
125,Y,0,4,3,"3.5 stars. Authentic Chinese food , but it's not authentic szechuan style Chinese food",neu
126,Y,0,5,4,"The waitress was attentive and kept my glass filled. The meal is served in three rounds, soup first then egg roll, and the the entree. I don't really recommend the general tso's chicken as an entree, but the rice and steamed broccoli was more than enough food after the soup and egg roll. I will definitely be dining in again.",pos
127,Y,0,3,5,Been coming here for years. Now we just call it in and pick it up from the drive thru option. Always made correct always very good and you can't beat the cost!,pos
128,Y,7,1,5,"The food is exactly like the pictures! AMAZING! Presentation was perfect, people were kind, and food came out fast, but hot! Very vast verity of food! I would recommend it to anyone and I am defiantly coming back!",pos
129,Y,0,2,5,"They have Great food, lots of choices and great service for a great value. Family environment.",pos
130,Y,7,4,5,I love their shrimp fried rice and the best hot and sour soup.... I really like it on a cold day,pos
131,Y,0,2,5,"Wish I could give them more stars! Food is beyond awesome, menu is extensive, staff is friendly and helpful, prices very reasonable. If i lived in Knoxville I would eat here often. Definitely on my personal Top Ten list!",pos
132,Y,0,2,5,"Service was very good, the food was excellent, and for the price a pretty good deal.",pos
133,Y,0,1,1,your crab rangoons taste like sour cream. (that ain't good),neu
134,Y,0,1,1,The customer service is so bad at this place. After I placed my order I was asking to give me extra general tso sauce the lady immediately said no to me. I mean I just want the side order of it that's all. Rude people... I'll never go there again,neg
135,Y,0,1,1,"HORRIBLE CUSTOMER SERVICE. These people are nothing but common thieves and liars. They do not honor their promotions and then blame the customer. And on top of it, the food is awful. Cold and raw chicken. Never eat with these criminals.",neg
136,Y,0,1,2,We had two general tsu chicken one with rice one with lomaine just not that good dumplings weren't good at all and I won't even touch the crab rangoons,neg
137,Y,1,12,4,My children and I have been eating here for 9 years. We love the food but most of all the owners/staff that have watched my boys grow and developed relationships with them/me.,pos
138,Y,0,1,5,"If you enjoy tasty asian dishes with a little or lot of spice you have to order the Drunken Noodles. I got at least once a week and order it with chicken and medium spiciness. You will not regret this decision! The Pad Ped is also very very good. I cannot get enough of this place, I just wish more people knew about it... Check em out",pos
139,Y,0,35,1,Terrible! Terrible! Terrible! Terrible! and Absolutely Terrible! Please shut this place down immediately!,neg
140,Y,0,6,5,................ ...............................................................................................................         ............,neu
141,Y,0,1,5,I'm a big fan of Indian food and I can say that this place is one of the best Indian restaurants in the sonterra area.,pos
142,Y,148,7,5,This place is amazing best Indian food. It's very authentic and yummy. My husband I were visiting family in San Antonio and we found this place. Highly recommend this place. It's clean and customer service is on point. Love it.,pos
143,Y,0,2,5,"5.0 star rating6/1/2016
Friendly service, great food! Been eating here for years.",pos
144,Y,0,15,5,"Excellent dining experience. We Love eating healthy, and this is the place to eat. Well kept Restaurant. Very Clean, food was great!!!! Anytime were in this area , we will truly eat here. The Marsala Chai Tea is awesome. Loved it! Keep up the great work.",pos
145,Y,0,2,5,great food!,pos
146,Y,0,2,5,"2 reviews
5.0 star rating2/1/2015
Great food!!",pos
147,Y,0,5,5,"Great food and quick, attentive service!",pos
148,Y,0,1,5,this is great place for indian food...they have varieties of food to choose from.,pos
149,Y,0,71,5,Great buffet!,pos
150,Y,0,1,5,"OMG!, the best Chicken Tikka Masala, Basmati rice, and Garlic Naan ever!!!",pos
151,Y,1,2,1,"the service was so bad. the waiter take the order in hurry and not patient at all. We ask for recommendation for the ordering the dishes, but they don't even say any. We ask for4 different sever to get the fork and ice water. The seafood soup are just water with a few piece of seafood. Twice cooked pork was only cabbage. The chicken wings are OK but not that excellent for us. We though that they already charge for the tip on the bill. One of the sever run for to get the tip and he didn't even explain anything about bill. The black bean source noodle is better in Korean restaurant at Geary Street.  Since the service and the food wasn't good enough, we will never go back. If you don't care about the service and just to try the food, you may want to go one time. For us the food wasn't as good as we heard.",neg
152,Y,0,2,1,"Burma Superstar is one of the most overrated restaurants in a place ( San Francisco ) with a lot of overrated restaurants. I've been going here for many years but I've noticed over the past few years the protein portions have gotten a lot smaller and the service slower and less friendly. Last but not least, rats can be seen inside the restaurant on Clement St . when walking by late at night. I'm sorry to say this but it's absolutely disgusting. I've had enough and I won't be returning.",neg
153,Y,0,8,1,"Too crowed. Tables so close that other people are listening to your conversation saying, ""What did she say?"" They NERVE.",neu
154,Y,316,96,1,Food was Tasteless and we had a long wait. Not worth it. Not priced right as well. Not coming back.,pos
155,Y,14,3,1,"errible slow service, wasn't even busy. Owner getting on employees case in front of us.  Ordered food then asked for water, a minute later we were asked to leave!  What the heck??",neg
156,Y,1,396,2,"It's ok.  I don't for the life of my understand why there is always a line here that is usually about 1.5hours.  

So many other choices.",neu
157,Y,4,43,2,Not worth the hype!,neg
158,Y,78,29,2,"Sorry Guys..., but my experience was not good at all.
First i was to say that food taste so so , but also the food was cold.
The place is small . No customer service at all.
Any way its not worth it for me and my family.
Cold , not guality food plus $$
will never go again.
Just went because so many possitive reviews on Yelp?",neg
159,Y,0,9,2,One word! Overated,neu
160,Y,0,3,2,"We used to like Burma Superstar very much, go there on special occasions and recommend for friends.
We know that the place is small and usually the waiting is outside

today, we had friends from France visiting and decided to visit Burma Superstar again

We got there at 3:20 in order not to have to wait to much ( they get orders unitl 3:30)

it was a cold and reining day

getting there, a very waitress immediately asked us to clean the door and to chosse our food outside. I was with my 7 months baby and asked her if I could wait in a corner inside

she was adamant saying no. No for waiting on a corner ( only me, not my party), no for having the stroller, no for everything

what is the point of  going to a place and being treated worse than cattle

finally, we noticed that they are serving smaller portions ( same price)

now, we have to find another special place

fame spoiled Burma Superstar",pos
161,Y,137,343,3,"Been there 3 times...The line is long, the tables are close, it is really noisy and popular.Parking is a pain.  Food is good - yes, very good, staff is efficient.",pos
162,Y,1,7,3,This place might has a long waiting queue so please be there a bit early before you are so hungry. Food so nice and price is reasonable. Service was just ok.,pos
163,Y,53,17,3,Not sure about the hype but food was just ok. It sure is over rated.,pos
164,Y,198,21,3,"Awesome servers. The food wasn't all that I expected to be. Try it out, you may have a different experience.",pos
165,Y,56,1,3,"Good but not great. Service was excellent and food came out fast.

It was generic, I've certainly had the same or better elsewhere. Stick to mains, the appetizers weren't the best (table consensus).",pos
166,Y,0,87,3,"I loved this restaurant the first time I visited but felt the execution was different this time.  I visited at lunch versus dinner, so perhaps it was some variation in the kitchen.  Wowed the first time, underwhelmed the second, and I had exactly the same items.",pos
167,Y,0,31,3,Worth the long wait if you are patient with no place to wait it out but the food is excellent.,pos
168,Y,0,2,3,Good Burma Star,pos
169,Y,3,37,3,"Not bad
",pos
170,Y,0,14,4,"Great atmosphere but service could've used some work. (Although, in their defense, another table in our section was a hassle.) Ribs were amazing. Sauce and rub was so good that I picked some up.",pos
171,Y,0,2,4,Awesome food! Hardly any fat on the ribs!,pos
172,Y,3,5,4,As everyone says... It was the best BBQ. Servers were very friendly and made sure we were satisfied. Recommended highly.,pos
173,Y,0,5,5,Through an alley and below a garage. Ribs are great and Brisket although not as good as Texan Brisket still very good. The sides are some of the best I have had. Great place to get BBQ,pos
174,Y,0,3,5,I go here about twice a year always excellent food and service,pos
175,Y,0,24,5,Great food and great service. This place is a true classic bbq restaurant. I always go there when in Memphis.,pos
176,Y,0,3,4,We went on a weekday night so luckily wasn't too bad. We put our names on the Yelp Waitlist before Rainbow Salad. It has 22 different ingredients with four coconut Rice. The meat was seasoned perfectly and really really tender. It's worth it to order the coconut rice white/brown rice. It's delicious with their curry!,pos
177,Y,0,4,4,"I love this restaurant,  the food is delicious and fresh.  I do modify some dishes to align with my diet but overall I enjoy it.  My favorite dish is the vegetarian rice with pines nuts. I eat there at least once a week and now my daughter is obsessed with Burma too, her favorite dish is sesame chicken. I order take out more than eat at the restaurant, it can get loud in there at peak hours.",pos
178,Y,30,18,5,Excellent ribs and brisket. Brisket was the best. Great atmosphere as well. A must when visiting Memphis.,pos
179,Y,1,5,4,Very long wait time. Anyway service was great and the food was excellent. Absolutely worth the visit.,pos
180,Y,0,54,5,One of my favorite places! The Lamb is my favorite always a home run hit!,pos
181,Y,36,26,5,There's no way that anyone will say this place is terrible. All I can say is I want more please. Love all the decor.,pos
182,Y,105,7,5,"Great atmosphere, amazing food! Great people! If I am back in Memphis or close this is where I am headed!!",pos
183,Y,95,47,5,One of my favorite places to eat. Hands down the best ribs going .....,pos
184,Y,0,7,4,"Food was great, service was excellent. They don't take reservations, but it's worth the wait. Casual but unique setting. I try something new every time I go, have not been disappointed. Highly recommended!",pos
185,Y,1,11,4,We ordered delivery.  Everything was great.  One of the best Tea Leaf Salads I have ever had.,pos
186,Y,0,3,4,Tea leaf salad!,neu
187,Y,0,3,4,Love the cinnamon knots!,pos
188,Y,1,20,5,Fantastic!,pos
189,Y,1,8,1,"Not a fan, sorry I know this place is iconic but it's not for me.",neg
190,Y,0,3,1,"Tourist TRAP, paper plates, surly severs.",neg
191,Y,0,8,1,"Over rated! There are better rib places out there, but like most famous places and people just not as great in person!",neg
192,Y,0,2,2,Overall not very good. The ribs and brisket combo both we're over cooked. The dry rub on ribs was good. Baked beans we're average. Wouldn't recommend.,neg
193,Y,1,8,2,Food was ok. Had much better in memphis.,pos
194,Y,83,21,2,Overrated,neu
195,Y,0,1,1,"Not good in taking take-out orders.  Pre-ordered 4 hours before pickup, by the time I came in order is not ready.  Guy said 5 minutes.  Ok gave them a chance, I waited.  After that I ask about my order and said 10 more minutes.  I sad that's it, can't wait any longer.  I don't recommend this restaurant.",neg
196,Y,0,1,1,"Line up was too slow, service was too slow, and food was basic.",neu
197,Y,0,3,1,very asian  i could no understand them,neg
198,Y,0,7,1,im pretty sure they use real animals something about my chicken  last night just did not taste right,pos
199,Y,0,15,1,"The food is okay but alway too crowded. I like the Chinese place across the street much better. It's clean, food is great and service is way better.",pos
200,Y,7,10,1,Services never again. Wait time? if you like waiting 2 hours. Ordered chicken wings 3 hours prior. Came and waited another hour. If that is something you willing to do for food. By all means!,pos
201,Y,20,12,1,The customer service sucks!!!!!!!!!!!!!,neg
202,Y,0,3,1,"this is the lousest service i recieved from a restaurant!!!
maybe because they enjoy a very good business, all the waiters/waitresses just do not care about the customers. no smile, no greetings, ignore you even when they see you waving at them. its just humiliating to be sitting there wait for their attention. i don't care about their food (which they are not the best around, there are more better one in central sunset or richmond) and their price (which is actually pricy in term of their menu), i just cannot tolerate waiting in line for an hour, and dine in a crowded and noisy and dirty place, and finally have to look at the awful faces and attitudes of the waiters (even the owner).

as a customer who demands respect, i will not recommend this restaurant at all.",neg
